<?xml version="1.0" encoding="utf-8"?>
<worldGeneration version="3"
				 xmlns="http://warpdrive.lemadec.org"
				 xmlns:xsi="http://www.w3.org/2001/XMLSchema-instance"
				 xsi:schemaLocation="http://warpdrive.lemadec.org WarpDrive.xsd">

	<structure group="star" name="red_dwarf" ratio="0.2">
		<shell name="core" minThickness="40" maxThickness="50"><!-- legacy radius was 42 -->
			<filler weight="1" block="minecraft:redstone_block" />
		</shell>
		<shell name="low_altitude" minThickness="4" maxThickness="6">
			<filler weight="1" block="warpdrive:gas" metadata="1" />
		</shell>
		<shell name="atmosphere" minThickness="2" maxThickness="2">
			<filler weight="1" block="warpdrive:gas" metadata="1" />
		</shell>
	</structure>

	<structure group="star" name="orange_dwarf" weight="1">
		<shell name="core" minThickness="1" maxThickness="1"><!-- mark the center -->
			<filler weight="1" block="minecraft:obsidian" />
		</shell>
		<shell name="mantle" minThickness="35" maxThickness="45"><!-- add bedrock to prevent warping inside -->
			<filler ratio="0.005" block="minecraft:bedrock" />
			<filler ratio="0.005" block="minecraft:glowstone" />
			<filler weight="1" block="minecraft:air" />
		</shell>
		<shell name="crust1" minThickness="1" maxThickness="1"><!-- add light source and solid block to protect inner side -->
			<filler weight="1" block="minecraft:glowstone" />
		</shell>
		<shell name="crust2" minThickness="2" maxThickness="2">
			<filler weight="1" block="minecraft:lava" />
		</shell>
		<shell name="surface" minThickness="1" maxThickness="1"><!-- add stained glass for color and holding fluid in place -->
			<filler weight="1" block="minecraft:stained_glass" metadata="14" />
		</shell>
	</structure>

	<structure group="star" name="yellow_giant" weight="1">
		<shell name="core" minThickness="1" maxThickness="1"><!-- mark the center -->
			<filler weight="1" block="minecraft:obsidian" />
		</shell>
		<shell name="mantle" minThickness="55" maxThickness="70"><!-- add bedrock to prevent warping inside -->
			<filler ratio="0.005" block="minecraft:bedrock" />
			<filler ratio="0.005" block="minecraft:glowstone" />
			<filler weight="1" block="minecraft:air" />
		</shell>
		<shell name="crust" minThickness="2" maxThickness="2"><!-- add light source and solid block to protect inner side -->
			<filler weight="1" block="minecraft:glowstone" />
		</shell>
		<shell name="surface" minThickness="1" maxThickness="1"><!-- add stained glass for color -->
			<filler weight="1" block="minecraft:stained_glass" metadata="1" />
		</shell>
		<shell name="low_altitude" minThickness="4" maxThickness="6">
			<filler weight="1" block="minecraft:air" />
		</shell>
		<shell name="atmosphere" minThickness="1" maxThickness="1"><!-- add stained glass for color -->
			<filler weight="1" block="minecraft:stained_glass" metadata="4" />
		</shell>
	</structure>

	<structure group="star" name="yellow_supergiant" ratio="0.2">
		<shell name="core" minThickness="1" maxThickness="1"><!-- mark the center -->
			<filler weight="1" block="minecraft:obsidian" />
		</shell>
		<shell name="mantle" minThickness="70" maxThickness="90"><!-- add bedrock to prevent warping inside -->
			<filler ratio="0.01" block="minecraft:bedrock" />
			<filler weight="1" block="minecraft:air" />
		</shell>
		<shell name="crust" minThickness="2" maxThickness="2"><!-- add light source and solid block to protect inner side -->
			<filler weight="1" block="minecraft:glowstone" />
		</shell>
		<shell name="surface" minThickness="1" maxThickness="1"><!-- add stained glass for color -->
			<filler weight="1" block="minecraft:stained_glass" metadata="1" />
		</shell>
		<shell name="low_altitude" minThickness="4" maxThickness="6">
			<filler weight="1" block="minecraft:air" />
		</shell>
		<shell name="atmosphere" minThickness="1" maxThickness="1"><!-- add stained glass for color -->
			<filler weight="1" block="warpdrive:gas" metadata="3" />
		</shell>
	</structure>


	<!-- 
	<structure group="moon" name="test" weight="100">
		<shell name="core" minThickness="1" maxThickness="1">
			<filler block="minecraft:bedrock" ratio=".001" />
		</shell>
		<shell name="mantle" minThickness="1" maxThickness="1">
			<filler block="minecraft:glass" ratio=".001" />
		</shell>
		<shell name="crust" minThickness="1" maxThickness="1">
			<filler block="minecraft:stained_glass" metadata="5" ratio=".001" />
		</shell>
		<shell name="surface" minThickness="1" maxThickness="1">
			<filler block="minecraft:stained_glass" metadata="15" />
		</shell>
	</structure>
	-->

	<structure group="moon" name="overworld.base" weight="100">
		<shell name="core" minThickness="4" maxThickness="15">
			<import group="moon.core" />
			<filler block="minecraft:bedrock" ratio=".001" />
		</shell>
		<shell name="mantle" minThickness="3" maxThickness="15">
			<import group="overworld_uncommon" />
			<filler block="minecraft:bedrock" ratio=".001" />
		</shell>
		<shell name="flow" minThickness="0" maxThickness="2">
			<import group="moon.flow" />
		</shell>
		<shell name="crust" minThickness="2" maxThickness="10">
			<import group="overworld_common" />
			<filler block="minecraft:bedrock" ratio=".001" />
		</shell>
		<shell name="surface" minThickness="1" maxThickness="3">
			<import group="overworld_surface" />
		</shell>
	</structure>

	<structure group="moon" name="overworld.rare" weight="20">
		<shell name="uranium" minThickness="0" maxThickness="2" mods="ic2">
			<filler block="ic2:resource" metadata="10" ratio=".1" /><!-- Uranium block -->
		</shell>
		<shell name="core" minThickness="1" maxThickness="10">
			<import group="moon.core" />
			<filler block="minecraft:bedrock" ratio=".001" />
		</shell>
		<shell name="mantle" minThickness="3" maxThickness="15">
			<import group="overworld_rare" />
			<filler block="minecraft:bedrock" ratio=".001" />
		</shell>
		<shell name="flow" minThickness="1" maxThickness="3">
			<import group="moon.flow" />
		</shell>
		<shell name="crust" minThickness="2" maxThickness="10">
			<import group="overworld_common" />
			<filler block="minecraft:bedrock" ratio=".001" />
		</shell>
		<shell name="surface" minThickness="1" maxThickness="3">
			<import group="overworld_surface" />
		</shell>
	</structure>

	<structure group="moon" name="overworld.empty" weight="20">
		<shell name="core" minThickness="1" maxThickness="1">
			<filler block="minecraft:bedrock" weight="100" />
		</shell>
		<shell name="empty" minThickness="6" maxThickness="29">
			<import group="gas" />
		</shell>
		<shell name="innerCrust" minThickness="1" maxThickness="1">
			<filler block="minecraft:obsidian" weight="100" />
			<filler block="minecraft:bedrock" ratio=".001" />
			<filler block="minecraft:glowstone" ratio=".001" />
		</shell>
		<shell name="mantle" minThickness="0" maxThickness="2">
			<filler block="minecraft:obsidian" weight="100" />
			<filler block="minecraft:bedrock" ratio=".001" />
		</shell>
		<shell name="crust" minThickness="1" maxThickness="5">
			<import group="overworld_common" />
			<filler block="minecraft:bedrock" ratio=".001" />
		</shell>
		<shell name="surface" minThickness="2" maxThickness="3">
			<import group="overworld_surface" />
		</shell>
	</structure>

	<structure group="moon" name="overworld.ship" weight="10">
		<generate group="smallship" />
		<shell name="core" minThickness="5" maxThickness="16">
			<import group="gas" />
			<filler block="minecraft:bedrock" ratio=".001" />
		</shell>
		<shell name="mantle" minThickness="3" maxThickness="17">
			<import group="overworld_uncommon" />
			<filler block="minecraft:bedrock" ratio=".001" />
		</shell>
		<shell name="flow" minThickness="0" maxThickness="2">
			<filler block="minecraft:obsidian" weight="100" mods="!appliedenergistics2" />
			<filler block="appliedenergistics2:sky_stone_block" weight="100" mods="appliedenergistics2" /><!-- Sky stone block -->
		</shell>
		<shell name="crust" minThickness="2" maxThickness="10">
			<import group="overworld_common" />
			<filler block="minecraft:bedrock" ratio=".001" />
		</shell>
		<shell name="surface" minThickness="1" maxThickness="3">
			<import group="overworld_surface" />
		</shell>
	</structure>

	<structure group="moon" name="overworld.corrupted" weight="20">
		<shell name="uranium" minThickness="0" maxThickness="1" mods="ic2">
			<filler block="ic2:resource" metadata="10" ratio=".1" /><!-- Uranium block -->
		</shell>
		<shell name="core" minThickness="5" maxThickness="16">
			<import group="overworld_rare" />
			<filler block="minecraft:bedrock" ratio=".001" />
		</shell>
		<shell name="mantle" minThickness="6" maxThickness="20">
			<import group="overworld_uncommon" />
			<filler block="minecraft:bedrock" ratio=".001" />
			<filler block="minecraft:gravel" ratio=".1" />
			<filler block="minecraft:lava" ratio=".05" />
		</shell>
		<shell name="crust" minThickness="10" maxThickness="20">
			<import group="overworld_common" />
			<filler block="minecraft:bedrock" ratio=".001" />
			<filler block="minecraft:sand" ratio=".1" />
			<filler block="minecraft:air" ratio=".2" />
		</shell>
		<shell name="surface" minThickness="2" maxThickness="4">
			<import group="overworld_surface" />
			<filler block="minecraft:air" ratio=".35" />
		</shell>
	</structure>

	<structure group="moon" name="nether" ratio="0.1">
		<shell name="uranium" minThickness="0" maxThickness="2" mods="ic2">
			<filler block="ic2:resource" metadata="10" ratio=".1" /><!-- Uranium block -->
		</shell>
		<shell name="core" minThickness="1" maxThickness="5">
			<filler block="minecraft:air" weight="1" />
			<filler block="minecraft:bedrock" ratio=".01" />
		</shell>
		<shell name="coreShell" minThickness="1" maxThickness="1">
			<filler block="minecraft:obsidian" weight="100" />
		</shell>
		<shell name="mantle" minThickness="6" maxThickness="20">
			<import group="nether" />
			<filler block="minecraft:bedrock" ratio=".001" />
			<filler block="minecraft:sand" metadata="1" ratio=".2" mods="!natura" />